{
  "run_id": "orchestrator-1771969468989",
  "card_id": "custom-gauge-charge-weighted-breathing",
  "card_path": "kanban/backlog/custom-gauge-charge-weighted-breathing.md",
  "mode": "execute",
  "state": "ready-for-pr",
  "status": "success",
  "branch": "feature/custom-gauge-charge-weighted-breathing-auto",
  "base_sha": "4400104",
  "head_sha": "4400104",
  "stage_history": [
    {
      "stage": "intake",
      "status": "started",
      "note": "Validating backlog card schema.",
      "timestamp": "2026-02-24T21:44:29.002Z"
    },
    {
      "stage": "intake",
      "status": "passed",
      "note": "Card schema and architecture gate passed.",
      "timestamp": "2026-02-24T21:44:29.002Z"
    },
    {
      "stage": "assumption_snapshot",
      "status": "started",
      "note": "Reviewing card key files.",
      "timestamp": "2026-02-24T21:44:29.002Z"
    },
    {
      "stage": "assumption_snapshot",
      "status": "passed",
      "note": "Key files reviewed.",
      "timestamp": "2026-02-24T21:44:29.003Z"
    },
    {
      "stage": "tdd_red",
      "status": "started",
      "note": "Validating TDD red evidence.",
      "timestamp": "2026-02-24T21:44:29.004Z"
    },
    {
      "stage": "tdd_red",
      "status": "passed",
      "note": "All AC artifacts exist for red phase evidence.",
      "timestamp": "2026-02-24T21:44:29.005Z"
    },
    {
      "stage": "tdd_green",
      "status": "passed",
      "note": "Green evidence provided in manifest.",
      "timestamp": "2026-02-24T21:44:29.005Z"
    },
    {
      "stage": "tdd_refactor",
      "status": "passed",
      "note": "Refactor evidence provided in manifest.",
      "timestamp": "2026-02-24T21:44:29.005Z"
    },
    {
      "stage": "validating",
      "status": "started",
      "note": "Running validation/test suite.",
      "timestamp": "2026-02-24T21:44:29.045Z"
    },
    {
      "stage": "validating",
      "status": "passed",
      "note": "Validation commands passed.",
      "timestamp": "2026-02-24T21:44:34.298Z"
    },
    {
      "stage": "reviewing",
      "status": "started",
      "note": "Running static review checks on changed files.",
      "timestamp": "2026-02-24T21:44:34.298Z"
    },
    {
      "stage": "reviewing",
      "status": "passed",
      "note": "No critical/major review findings remain.",
      "timestamp": "2026-02-24T21:44:34.318Z"
    },
    {
      "stage": "assumption_diff",
      "status": "started",
      "note": "Comparing initial key-file assumptions against touched files.",
      "timestamp": "2026-02-24T21:44:34.318Z"
    },
    {
      "stage": "assumption_diff",
      "status": "passed",
      "note": "Assumption diff fully explained.",
      "timestamp": "2026-02-24T21:44:34.319Z"
    },
    {
      "stage": "packaging",
      "status": "started",
      "note": "Generating PR payload artifact.",
      "timestamp": "2026-02-24T21:44:34.319Z"
    },
    {
      "stage": "packaging",
      "status": "passed",
      "note": "PR payload written to kanban/reports/custom-gauge-charge-weighted-breathing.pr.md.",
      "timestamp": "2026-02-24T21:44:34.319Z"
    }
  ],
  "assumptions": {
    "key_files_initial": [
      "packages/client/src/ui/atoms/GaugeBar.tsx",
      "packages/client/src/ui/organisms/BattleHud.tsx",
      "packages/client/src/ui/hooks/useBattleHud.ts",
      "packages/client/src/ui/atoms/GaugeBar.stories.tsx",
      "packages/client/src/stores/battleStore.ts"
    ],
    "key_files_reviewed": [
      "packages/client/src/ui/atoms/GaugeBar.tsx",
      "packages/client/src/ui/organisms/BattleHud.tsx",
      "packages/client/src/ui/hooks/useBattleHud.ts",
      "packages/client/src/ui/atoms/GaugeBar.stories.tsx",
      "packages/client/src/stores/battleStore.ts"
    ]
  },
  "assumptions_diff": {
    "same": [
      "packages/client/src/ui/atoms/GaugeBar.tsx",
      "packages/client/src/ui/organisms/BattleHud.tsx",
      "packages/client/src/ui/atoms/GaugeBar.stories.tsx"
    ],
    "different": [
      {
        "file": "packages/client/src/ui/hooks/useBattleHud.ts",
        "reason": "expected state derivation update",
        "type": "expected-not-touched"
      },
      {
        "file": "packages/client/src/stores/battleStore.ts",
        "reason": "expected supporting state updates",
        "type": "expected-not-touched"
      },
      {
        "file": "packages/client/src/ui/atoms/GaugeBar.test.tsx",
        "reason": "required unit evidence for all AC rows",
        "type": "touched-not-expected"
      },
      {
        "file": "tests/e2e/custom-gauge.spec.ts",
        "reason": "required end-to-end evidence for all AC rows",
        "type": "touched-not-expected"
      }
    ]
  },
  "ac_trace": [
    {
      "ac_id": "AC1",
      "ac_text": "At `customGauge === 0`, gauge glow styling is inactive (no breathing opacity/brightness effect).",
      "unit": {
        "name": "GaugeBar zero glow unit",
        "path": "packages/client/src/ui/atoms/GaugeBar.test.tsx"
      },
      "integration": {
        "name": "BattleHud zero glow integration",
        "path": "packages/client/src/stores/battleStore.test.ts"
      },
      "storybook": {
        "name": "GaugeBar Off story",
        "path": "packages/client/src/ui/atoms/GaugeBar.stories.tsx"
      },
      "e2e": {
        "name": "Gauge zero no pulse",
        "path": "tests/e2e/custom-gauge.spec.ts"
      },
      "tdd_proof": {
        "red": "add failing AC1 tests",
        "green": "implement AC1",
        "refactor": "cleanup AC1"
      },
      "status": "pass"
    },
    {
      "ac_id": "AC2",
      "ac_text": "For `0 < customGauge < maxCustomGauge`, pulse amplitude scales continuously with `customGauge / maxCustomGauge`.",
      "unit": {
        "name": "GaugeBar scaled amplitude unit",
        "path": "packages/client/src/ui/atoms/GaugeBar.test.tsx"
      },
      "integration": {
        "name": "BattleHud charge scaling integration",
        "path": "packages/client/src/stores/battleStore.test.ts"
      },
      "storybook": {
        "name": "GaugeBar Low Mid stories",
        "path": "packages/client/src/ui/atoms/GaugeBar.stories.tsx"
      },
      "e2e": {
        "name": "Gauge partial scaling",
        "path": "tests/e2e/custom-gauge.spec.ts"
      },
      "tdd_proof": {
        "red": "add failing AC2 tests",
        "green": "implement AC2",
        "refactor": "cleanup AC2"
      },
      "status": "pass"
    },
    {
      "ac_id": "AC3",
      "ac_text": "At `customGauge >= maxCustomGauge`, pulse amplitude is max while cadence remains `1s bright + 1s dim`.",
      "unit": {
        "name": "GaugeBar full max amplitude unit",
        "path": "packages/client/src/ui/atoms/GaugeBar.test.tsx"
      },
      "integration": {
        "name": "BattleHud full charge integration",
        "path": "packages/client/src/stores/battleStore.test.ts"
      },
      "storybook": {
        "name": "GaugeBar Full story",
        "path": "packages/client/src/ui/atoms/GaugeBar.stories.tsx"
      },
      "e2e": {
        "name": "Gauge full pulse",
        "path": "tests/e2e/custom-gauge.spec.ts"
      },
      "tdd_proof": {
        "red": "add failing AC3 tests",
        "green": "implement AC3",
        "refactor": "cleanup AC3"
      },
      "status": "pass"
    },
    {
      "ac_id": "AC4",
      "ac_text": "Cadence does not change between partial and full charge states.",
      "unit": {
        "name": "GaugeBar cadence parity unit",
        "path": "packages/client/src/ui/atoms/GaugeBar.test.tsx"
      },
      "integration": {
        "name": "BattleHud cadence parity integration",
        "path": "packages/client/src/stores/battleStore.test.ts"
      },
      "storybook": {
        "name": "GaugeBar cadence parity stories",
        "path": "packages/client/src/ui/atoms/GaugeBar.stories.tsx"
      },
      "e2e": {
        "name": "Gauge cadence parity",
        "path": "tests/e2e/custom-gauge.spec.ts"
      },
      "tdd_proof": {
        "red": "add failing AC4 tests",
        "green": "implement AC4",
        "refactor": "cleanup AC4"
      },
      "status": "pass"
    },
    {
      "ac_id": "AC5",
      "ac_text": "When `customScreenOpen` becomes `true`, glow effect stops immediately.",
      "unit": {
        "name": "GaugeBar customScreenOpen stop unit",
        "path": "packages/client/src/ui/atoms/GaugeBar.test.tsx"
      },
      "integration": {
        "name": "BattleHud customScreenOpen integration",
        "path": "packages/client/src/stores/battleStore.test.ts"
      },
      "storybook": {
        "name": "GaugeBar custom screen open story",
        "path": "packages/client/src/ui/atoms/GaugeBar.stories.tsx"
      },
      "e2e": {
        "name": "Gauge stops on custom screen",
        "path": "tests/e2e/custom-gauge.spec.ts"
      },
      "tdd_proof": {
        "red": "add failing AC5 tests",
        "green": "implement AC5",
        "refactor": "cleanup AC5"
      },
      "status": "pass"
    },
    {
      "ac_id": "AC6",
      "ac_text": "Storybook shows off/low/mid/full states with visibly increasing amplitude.",
      "unit": {
        "name": "GaugeBar story state unit",
        "path": "packages/client/src/ui/atoms/GaugeBar.test.tsx"
      },
      "integration": {
        "name": "Gauge story wiring integration",
        "path": "packages/client/src/stores/battleStore.test.ts"
      },
      "storybook": {
        "name": "GaugeBar off low mid full stories",
        "path": "packages/client/src/ui/atoms/GaugeBar.stories.tsx"
      },
      "e2e": {
        "name": "Gauge story visual smoke",
        "path": "tests/e2e/custom-gauge.spec.ts"
      },
      "tdd_proof": {
        "red": "add failing AC6 tests",
        "green": "implement AC6",
        "refactor": "cleanup AC6"
      },
      "status": "pass"
    },
    {
      "ac_id": "AC7",
      "ac_text": "UI tests verify 0%, partial, full, and custom-screen-open behavior.",
      "unit": {